name,date_posted
عملية أنثروبويد .. إغتيال الجلاد، وجوه من الظل ، عبد الصادق بن عيسى ، ميدي1، هاربون ، ملفات بوليسية ، لحظات في التاريخ,1899-12-02 16:37:00
Social Cohesion and Human Nature,1948-12-24 09:00:00
Social Cohesion and Government,1949-01-02 09:00:00
The Role of Individuality,1949-01-09 09:00:00
The Conflict of Technique and Human Nature,1949-01-16 09:00:00
Control and Initiative: Their Respective Spheres,1949-01-23 09:00:00
Individual and Social Ethics,1949-01-30 09:00:00
British Rule In India,1951-12-02 09:00:00
The Psychology of Encounters,1952-12-14 09:00:00
The Sciences and Man's Community,1953-12-20 09:00:00
